{
	"id": "bach-six-partitas",
	"title": {
		"de": "Partiten",
		"en": "Partitas"
	},
	"expansion_pattern": {
		"de": "Partita Nr. {num} in {key}",
		"en": "Partita no. {num} in {key}"
	},
	"attribution": [
		{
			"composer": "bach",
			"dates": {
				"published": 1731
			}
		}
	],
	"scheme": "bwv",
	"description": "Clavier-Ãœbung I",
	"compositions": ["825", "826", "827", "828", "829", "830"]
}
